{
  "published_at": "2026-10-16T12:54:25Z",
  "model": "macrogauge_outlook_v1",
  "as_of": "2026-10-16",
  "origin_month": "2026-09",
  "horizon_months": 12,
  "latest_complete_month_yoy_pct": 3.28,
  "history": [
    {
      "month": "2024-09",
      "yoy_pct": 1.13
    },
    {
      "month": "2024-10",
      "yoy_pct": 1.44
    },
    {
      "month": "2024-11",
      "yoy_pct": 1.71
    },
    {
      "month": "2024-12",
      "yoy_pct": 1.83
    },
    {
      "month": "2025-01",
      "yoy_pct": 2.08
    },
    {
      "month": "2025-02",
      "yoy_pct": 1.95
    },
    {
      "month": "2025-03",
      "yoy_pct": 1.59
    },
    {
      "month": "2025-04",
      "yoy_pct": 1.47
    },
    {
      "month": "2025-05",
      "yoy_pct": 1.61
    },
    {
      "month": "2025-06",
      "yoy_pct": 1.83
    },
    {
      "month": "2025-07",
      "yoy_pct": 1.78
    },
    {
      "month": "2025-08",
      "yoy_pct": 2.06
    },
    {
      "month": "2025-09",
      "yoy_pct": 2.09
    },
    {
      "month": "2025-10",
      "yoy_pct": 1.97
    },
    {
      "month": "2025-11",
      "yoy_pct": 1.95
    },
    {
      "month": "2025-12",
      "yoy_pct": 1.81
    },
    {
      "month": "2026-01",
      "yoy_pct": 1.74
    },
    {
      "month": "2026-02",
      "yoy_pct": 1.85
    },
    {
      "month": "2026-03",
      "yoy_pct": 2.87
    },
    {
      "month": "2026-04",
      "yoy_pct": 3.14
    },
    {
      "month": "2026-05",
      "yoy_pct": 3.45
    },
    {
      "month": "2026-06",
      "yoy_pct": 2.62
    },
    {
      "month": "2026-07",
      "yoy_pct": 2.78
    },
    {
      "month": "2026-08",
      "yoy_pct": 2.77
    },
    {
      "month": "2026-09",
      "yoy_pct": 3.28
    }
  ],
  "forecast": [
    {
      "month": "2026-10",
      "central_yoy_pct": 3.93,
      "mom_pct": 0.325,
      "low_yoy_pct": 3.4,
      "high_yoy_pct": 4.46
    },
    {
      "month": "2026-11",
      "central_yoy_pct": 4.52,
      "mom_pct": 0.321,
      "low_yoy_pct": 3.78,
      "high_yoy_pct": 5.26
    },
    {
      "month": "2026-12",
      "central_yoy_pct": 5.09,
      "mom_pct": 0.239,
      "low_yoy_pct": 4.18,
      "high_yoy_pct": 6.0
    },
    {
      "month": "2027-01",
      "central_yoy_pct": 4.79,
      "mom_pct": 0.256,
      "low_yoy_pct": 3.74,
      "high_yoy_pct": 5.84
    },
    {
      "month": "2027-02",
      "central_yoy_pct": 4.44,
      "mom_pct": 0.239,
      "low_yoy_pct": 3.27,
      "high_yoy_pct": 5.61
    },
    {
      "month": "2027-03",
      "central_yoy_pct": 3.25,
      "mom_pct": 0.239,
      "low_yoy_pct": 1.96,
      "high_yoy_pct": 4.54
    },
    {
      "month": "2027-04",
      "central_yoy_pct": 2.94,
      "mom_pct": 0.243,
      "low_yoy_pct": 1.55,
      "high_yoy_pct": 4.33
    },
    {
      "month": "2027-05",
      "central_yoy_pct": 2.55,
      "mom_pct": 0.243,
      "low_yoy_pct": 1.06,
      "high_yoy_pct": 4.04
    },
    {
      "month": "2027-06",
      "central_yoy_pct": 3.27,
      "mom_pct": 0.243,
      "low_yoy_pct": 1.69,
      "high_yoy_pct": 4.85
    },
    {
      "month": "2027-07",
      "central_yoy_pct": 3.28,
      "mom_pct": 0.243,
      "low_yoy_pct": 1.62,
      "high_yoy_pct": 4.94
    },
    {
      "month": "2027-08",
      "central_yoy_pct": 3.41,
      "mom_pct": 0.243,
      "low_yoy_pct": 1.67,
      "high_yoy_pct": 5.15
    },
    {
      "month": "2027-09",
      "central_yoy_pct": 3.12,
      "mom_pct": 0.243,
      "low_yoy_pct": 1.3,
      "high_yoy_pct": 4.94
    }
  ],
  "base_effects_only": [
    {
      "month": "2026-10",
      "yoy_pct": 3.77
    },
    {
      "month": "2026-11",
      "yoy_pct": 4.2
    },
    {
      "month": "2026-12",
      "yoy_pct": 4.69
    },
    {
      "month": "2027-01",
      "yoy_pct": 4.29
    },
    {
      "month": "2027-02",
      "yoy_pct": 3.87
    },
    {
      "month": "2027-03",
      "yoy_pct": 2.61
    },
    {
      "month": "2027-04",
      "yoy_pct": 2.21
    },
    {
      "month": "2027-05",
      "yoy_pct": 1.75
    },
    {
      "month": "2027-06",
      "yoy_pct": 2.38
    },
    {
      "month": "2027-07",
      "yoy_pct": 2.32
    },
    {
      "month": "2027-08",
      "yoy_pct": 2.36
    },
    {
      "month": "2027-09",
      "yoy_pct": 2.0
    }
  ],
  "sigma_monthly_pp": 0.5251,
  "sigma_window_months": 60,
  "driver_coverage_pct": 87.5,
  "drivers": [
    {
      "key": "fuel",
      "name": "Fuel futures (RBOB 60% / WTI 40%, 2mo)",
      "value": 5.1033,
      "unit": "%",
      "reading": "+5.10%",
      "as_of": "2026-09-30",
      "status": "live",
      "effect": "85% pass-through over 2 months, then flat",
      "sources": [
        "fmp_rbob",
        "fmp_wti"
      ]
    },
    {
      "key": "shelter",
      "name": "New-lease rents (ZORI + Apartment List, 12mo median)",
      "value": 0.2063,
      "unit": "%/mo",
      "reading": "+0.21%/mo",
      "as_of": "2026-09-01",
      "status": "live",
      "effect": "drives rent and CPI-comparable OER; 6-month half-life",
      "sources": [
        "zori_us",
        "aptlist_us"
      ]
    },
    {
      "key": "food_home",
      "name": "Agricultural futures composite (8 contracts, 3mo)",
      "value": 5.6533,
      "unit": "%",
      "reading": "+5.65%",
      "as_of": "2026-09-30",
      "status": "live",
      "effect": "15% farm-share pass-through over 4 months",
      "sources": [
        "fmp_corn",
        "fmp_wheat",
        "fmp_soybeans",
        "fmp_soybean_oil",
        "fmp_coffee",
        "fmp_sugar",
        "fmp_cocoa",
        "fmp_live_cattle"
      ]
    },
    {
      "key": "nat_gas",
      "name": "Henry Hub natural gas (3mo)",
      "value": -7.5725,
      "unit": "%",
      "reading": "-7.57%",
      "as_of": "2026-09-30",
      "status": "live",
      "effect": "35% pass-through into utility rates in months 2\u20136",
      "sources": [
        "fmp_natgas"
      ]
    },
    {
      "key": "used_vehicles",
      "name": "Manheim used wholesale (3mo)",
      "value": -3.2879,
      "unit": "%",
      "reading": "-3.29%",
      "as_of": "2026-09-01",
      "status": "live",
      "effect": "70% retail pass-through over 3 months, on the official used-car trend",
      "sources": [
        "manheim_uvvi_m"
      ]
    },
    {
      "key": "new_vehicles",
      "name": "New vehicles (own complete-month trend)",
      "value": 0.0929,
      "unit": "%/mo",
      "reading": "+0.09%/mo",
      "as_of": "2026-09-01",
      "status": "fallback",
      "effect": "KBB ATP is not yet a stable production input",
      "sources": [
        "CUUR0000SETA01"
      ]
    },
    {
      "key": "wages",
      "name": "Atlanta Fed wage growth",
      "value": 3.9,
      "unit": "%/yr",
      "reading": "+3.90%/yr",
      "as_of": "2026-09-01",
      "status": "live",
      "effect": "25% terminal anchor for food-away and sticky services",
      "sources": [
        "FRBATLWGT3MMAUMHWGO"
      ]
    },
    {
      "key": "goods_pipeline",
      "name": "Ex-energy pipeline (PPI + imports, 0.5\u00d7 strength)",
      "value": 1.0,
      "unit": "pp/yr",
      "reading": "+1.00pp/yr",
      "as_of": "2026-09-01",
      "status": "live",
      "effect": "tilt capped at \u00b11pp/yr on new_vehicles, apparel, other",
      "sources": [
        "PPIACO",
        "PCUOMFGOMFG",
        "IREXPETCOM"
      ]
    }
  ],
  "component_paths": {
    "shelter_owned": [
      {
        "month": "2026-10",
        "mom_pct": 0.2018,
        "index": 142.566627
      },
      {
        "month": "2026-11",
        "mom_pct": 0.1978,
        "index": 142.84859
      },
      {
        "month": "2026-12",
        "mom_pct": 0.1942,
        "index": 143.126027
      },
      {
        "month": "2027-01",
        "mom_pct": 0.191,
        "index": 143.399465
      },
      {
        "month": "2027-02",
        "mom_pct": 0.1882,
        "index": 143.669376
      },
      {
        "month": "2027-03",
        "mom_pct": 0.1857,
        "index": 143.936179
      },
      {
        "month": "2027-04",
        "mom_pct": 0.1835,
        "index": 144.20025
      },
      {
        "month": "2027-05",
        "mom_pct": 0.1815,
        "index": 144.461926
      },
      {
        "month": "2027-06",
        "mom_pct": 0.1797,
        "index": 144.721507
      },
      {
        "month": "2027-07",
        "mom_pct": 0.1781,
        "index": 144.97926
      },
      {
        "month": "2027-08",
        "mom_pct": 0.1767,
        "index": 145.235424
      },
      {
        "month": "2027-09",
        "mom_pct": 0.1754,
        "index": 145.490214
      }
    ],
    "other": [
      {
        "month": "2026-10",
        "mom_pct": 0.4489,
        "index": 138.613629
      },
      {
        "month": "2026-11",
        "mom_pct": 0.4479,
        "index": 139.23454
      },
      {
        "month": "2026-12",
        "mom_pct": 0.447,
        "index": 139.856854
      },
      {
        "month": "2027-01",
        "mom_pct": 0.446,
        "index": 140.480563
      },
      {
        "month": "2027-02",
        "mom_pct": 0.445,
        "index": 141.105663
      },
      {
        "month": "2027-03",
        "mom_pct": 0.444,
        "index": 141.732146
      },
      {
        "month": "2027-04",
        "mom_pct": 0.443,
        "index": 142.360007
      },
      {
        "month": "2027-05",
        "mom_pct": 0.442,
        "index": 142.989239
      },
      {
        "month": "2027-06",
        "mom_pct": 0.441,
        "index": 143.619836
      },
      {
        "month": "2027-07",
        "mom_pct": 0.44,
        "index": 144.251792
      },
      {
        "month": "2027-08",
        "mom_pct": 0.439,
        "index": 144.885099
      },
      {
        "month": "2027-09",
        "mom_pct": 0.438,
        "index": 145.519751
      }
    ],
    "food_home": [
      {
        "month": "2026-10",
        "mom_pct": 0.3424,
        "index": 134.621359
      },
      {
        "month": "2026-11",